{
  "schemaVersion": "makers-anvil.source-manifest.v1",
  "claimState": "staged",
  "standardPath": "docs/CODE_EXPLAINABILITY_STANDARD.md",
  "entrypointPath": "docs/START_HERE.md",
  "implementationGuidePath": "docs/IMPLEMENTATION_GUIDE.md",
  "learningResourcesPath": "docs/LEARNING_RESOURCES.md",
  "sourceWalkthroughPath": "docs/SOURCE_WALKTHROUGH.md",
  "referenceStudyPath": "docs/PREVIOUS_APP_REFERENCE_STUDY.md",
  "lineByLineGuidePath": "docs/LINE_BY_LINE_CODE_GUIDE.md",
  "learningCoveragePath": "state/learning_coverage.json",
  "passReportTemplatePath": "docs/PASS_REPORT_TEMPLATE.md",
  "files": [
    {"path": ".github/workflows/ci.yml", "category": "automation", "purpose": "Runs the repository verifier and tests on Windows, Ubuntu, and macOS for each protected change.", "maintenanceNotes": "Keep platform coverage and proof commands aligned with the local continue protocol."},
    {"path": ".gitignore", "category": "governance", "purpose": "Prevents generated caches, runtime data, editor state, and reference-only material from entering product history.", "maintenanceNotes": "Add only non-product artifacts; never hide required source, schemas, tests, or durable truth."},
    {"path": "LICENSE", "category": "governance", "purpose": "Defines the MIT terms under which Makers Anvil source may be used, changed, and redistributed.", "maintenanceNotes": "Change licensing only through an explicit project-level decision with repository-wide review."},
    {"path": "README.md", "category": "documentation", "purpose": "Introduces the product, local commands, portability contract, safety status, and developer entrypoints.", "maintenanceNotes": "Keep current pass wording, commands, and links synchronized with verified application behavior."},
    {"path": "backend/src/makers_anvil_backend/__init__.py", "category": "backend", "purpose": "Declares the backend package and its current application version.", "maintenanceNotes": "Keep exports small and change the version only when release/version policy is defined."},
    {"path": "backend/src/makers_anvil_backend/__main__.py", "category": "backend", "purpose": "Allows the backend package to start the local server through Python module execution.", "maintenanceNotes": "Remain a thin delegation layer so server behavior stays centralized in server.py."},
    {"path": "backend/src/makers_anvil_backend/api/__init__.py", "category": "backend", "purpose": "Marks the package boundary for read routes and tightly scoped mutation routing code.", "maintenanceNotes": "Do not place service, authorization policy, or filesystem behavior in this package marker."},
    {"path": "backend/src/makers_anvil_backend/api/app.py", "category": "backend", "purpose": "Maps fixed reads including contained artifacts plus guarded intake, preference, and contained-preflight mutations to services.", "maintenanceNotes": "Keep artifact/lifecycle reads GET-only, block undeclared mutations, and preserve token, origin, media, body, id, kind, and typed-error checks."},
    {"path": "backend/src/makers_anvil_backend/desktop.py", "category": "backend", "purpose": "Owns the native pywebview window, ephemeral loopback server lifecycle, and console-optional packaged-binary smoke mode.", "maintenanceNotes": "Keep direct JS bridging, downloads, file URLs, remote debugging, fixed ports, remote binds, and every mutation beyond guarded intake disabled."},
    {"path": "backend/src/makers_anvil_backend/domain/__init__.py", "category": "backend", "purpose": "Marks the package boundary for shared domain vocabulary and value types.", "maintenanceNotes": "Keep domain definitions independent from HTTP, UI, and filesystem implementations."},
    {"path": "backend/src/makers_anvil_backend/domain/claim_state.py", "category": "backend", "purpose": "Defines the closed truth vocabulary used by APIs, schemas, status records, and badges.", "maintenanceNotes": "Add claim states only with schema, UI, verifier, and durable-status updates in the same pass."},
    {"path": "backend/src/makers_anvil_backend/runtime_resources.py", "category": "backend", "purpose": "Resolves source and PyInstaller-bundled frontend resources without working-directory or machine-path assumptions.", "maintenanceNotes": "Fail closed on incomplete resources and never search user, reference, or current-working directories as fallbacks."},
    {"path": "backend/src/makers_anvil_backend/server.py", "category": "backend", "purpose": "Serves static assets, read APIs, and bounded guarded intake, preference, and preflight POST routes on loopback.", "maintenanceNotes": "Preserve loopback binding, security headers, no CORS, bounded JSON, exact intake length, bodyless run/cancel, console-optional logging, and blocked mutation handling."},
    {"path": "backend/src/makers_anvil_backend/services/__init__.py", "category": "backend", "purpose": "Marks the package boundary for focused application and filesystem services.", "maintenanceNotes": "Keep service modules cohesive and avoid turning this package marker into a dependency hub."},
    {"path": "backend/src/makers_anvil_backend/services/activity_log.py", "category": "backend", "purpose": "Persists bounded create-only server-authored completion events with fixed path-free presentation.", "maintenanceNotes": "Never accept arbitrary browser events, free text, source paths, tokens, commands, mutation, or deletion."},
    {"path": "backend/src/makers_anvil_backend/services/app_state.py", "category": "backend", "purpose": "Composes workspace, planning, tools, contained preflight/artifact reads, lifecycle previews, experience, and blocked state.", "maintenanceNotes": "Delegate focused behavior, keep evidence/lifecycle reads read-only, and limit mutations to guarded intake, preferences, and one STL preflight."},
    {"path": "backend/src/makers_anvil_backend/services/authorized_intake.py", "category": "backend", "purpose": "Authorizes one selected local file and streams its exact bytes into private app-owned quarantine storage.", "maintenanceNotes": "Preserve same-origin token checks, one-time expiry, allowlists, exact lengths, hashing, atomic replacement, rollback, and path privacy."},
    {"path": "backend/src/makers_anvil_backend/services/capability_matrix.py", "category": "backend", "purpose": "Derives five user-facing capability lanes from current intake, route, output, and tool truth.", "maintenanceNotes": "Do not imply that preview-ready, detected, or planned means executable."},
    {"path": "backend/src/makers_anvil_backend/services/contained_execution.py", "category": "backend", "purpose": "Owns one-slot STL preflight, cancellation, fixed report/proof generation, validation, and bounded JSON reads.", "maintenanceNotes": "Keep scope to one app-owned STL check and never add arbitrary paths, commands, processes, tools, toolpaths, or host output opening."},
    {"path": "backend/src/makers_anvil_backend/services/execution_audit.py", "category": "backend", "purpose": "Creates and validates fixed-vocabulary immutable ordered lifecycle events for contained executions.", "maintenanceNotes": "Preserve exclusive writes, contiguous sequence, fixed summaries, generated identifiers, path privacy, and rejection of arbitrary event text."},
    {"path": "backend/src/makers_anvil_backend/services/execution_gate.py", "category": "backend", "purpose": "Evaluates ten required evidence classes for one allowlisted route while execution remains impossible.", "maintenanceNotes": "Never create requests, accept authorization, resolve paths, construct commands, run processes, write logs, cancel, or capture proof."},
    {"path": "backend/src/makers_anvil_backend/services/execution_request.py", "category": "backend", "purpose": "Composes deterministic logical execution intent, unaccepted authorization, and empty audit plans without persistence.", "maintenanceNotes": "Keep scope aligned with execution gates and never persist requests, accept consent, write events, resolve paths, or run processes."},
    {"path": "backend/src/makers_anvil_backend/services/intake_catalog.py", "category": "backend", "purpose": "Stores and validates legacy metadata plus authorized app-owned intake records without exposing source paths.", "maintenanceNotes": "Validate both schema generations, preserve logical-only public locations, and never modify a selected source file."},
    {"path": "backend/src/makers_anvil_backend/services/intake_preview.py", "category": "backend", "purpose": "Revalidates authorized app-owned raster bytes for bounded same-origin workbench previews.", "maintenanceNotes": "Keep reads size-limited, digest-checked, signature-checked, path-private, raster-only, and free of external effects."},
    {"path": "backend/src/makers_anvil_backend/services/job_records.py", "category": "backend", "purpose": "Constructs and strictly validates prepared-job and cancellation runtime records independently from storage orchestration.", "maintenanceNotes": "Keep logical-token, timestamp, field-set, false-effect, and atomic-write rules synchronized with runtime schemas."},
    {"path": "backend/src/makers_anvil_backend/services/job_workspace.py", "category": "backend", "purpose": "Prepares deterministic contained job workspaces and records cancellation intent without executable behavior.", "maintenanceNotes": "Preserve logical-only records, atomic writes, idempotency, symlink/traversal rejection, and false process/output claims."},
    {"path": "backend/src/makers_anvil_backend/services/lifecycle_dry_run.py", "category": "backend", "purpose": "Builds five lifecycle previews from bounded app-owned metadata inventory and bundled-resource existence evidence.", "maintenanceNotes": "Keep content, names, paths, archives, network, packages, installers, software mutation, processes, and deletion absent; preserve the global scan cap."},